Speaker,Speech,Words_in_Speech,Language
श्री निशिकान्त दुबे ( गोड्डा ),"अध्यक्ष महोदया , मैं आपका , माननीय प्रधान मंत्री जी और अपनी पार्टी के प्रति आभारी हूं कि उन्होंने श्री अनुराग सिंह ठाकुर द्वारा प्रस्तावित प्रस्ताव का अनुमोदन करने के लिए मुझे खड़ा किया है। कल राष्ट्रपति जी का अभिभाषण हुआ और लगातार अखबारों , टेलीविजन चैनल पर सब पोलीटिकल पार्टीज़ के लोग जो ऑपोजिशन में हैं , हारकर बैठे हुए हैं , शायद उन्हें करने के लिए कोई काम नहीं है , कह रहे हैं कि कुछ नहीं है , बेकार है , किस तरह का अभिभाषण है। मैं उन लोगों से पूछना चाहता हूं कि आजादी के इतने वर्षों बाद क्या आज देश में रोटी , कपड़ा और मकान की समस्या नहीं है। यदि कोई सरकार बात करेगी तो वह रोटी , कपड़ा और मकान की बात करेगी या नहीं। 15.04 hrs ( Hon. Deputy Speakerin the Chair) क्या हम भगवान की बात नहीं करेंगे ? यदि ब्रह्मा , विष्णु , महेश भगवान हैं , यदि ईसा मसीह भगवान हैं , पैगम्बर मोहम्मद भगवान हैं तो हम उनकी बात नहीं करेंगे तो किसकी बात करेंगे। क्या हम नदी - नाले की बात नहीं करेंगे कि गंगा का क्या होगा , यमुना का क्या होगा ? क्या हम नदी बदल देंगे , क्या हम शहर बदल देंगे कि दिल्ली में क्या होगा , मुम्बई में क्या होगा , पटना में क्या होगा , बनारस में क्या होगा , रांची में क्या होगा ? क्या हम पड़ोसी बदल देंगे कि पाकिस्तान में क्या होगा , बंगलादेश में क्या होगा ? आखिर क्या बात करें जिससे आपको लगे कि बहुत बढ़िया बात हो गई , बहुत अच्छी बात हो गई सरकार चल रही है। हमारे प्रधानमंत्री जी हमेशा कहते हैं कि मैं छोटा आदमी हूं , छोटे - छोटे काम करना चाहता हूं और यदि आपको इस अभिभाषण में छोटा - छोटा काम नहीं दिखाई देता है तो यह आपका दोष है , लेकिन बाद में मैंने रिअलाइज किया कि मैं किन लोगों से पूछने की बात करता हूं , राष्ट्रपति जी के अभिभाषण में कहा गया है कि आप लोगों को शांत रहना चाहिए।",344,hi
HON. DEPUTY SPEAKER,"Shri Dubey, please address the Chair.",6,en
"Hon. Members, do not make any commentary because you will have the opportunity to speak. … (Interruptions) PROF. SAUGATA ROY (DUM DUM)","This is not a comment, Sir, this is reality.",9,en
HON. DEPUTY SPEAKER,"Whatever is the reality, you can speak about it when the time comes for you to speak. I will give sufficient time to you.",24,en
"Shri Dubey, please address the Chair. श्री निशिकान्त दुबे","उपाध्यक्ष महोदय , एक संस्कृत में कहावत है , पिण्डे - पिण्डे मतिर्भिना कुण्डे नवं पयः ; जातो जातो नवाचारौ नवा वाणी मुखे मुखे , पिण्ड - पिण्ड में मति की भिन्नता होती है , एक जगह से दूसरे जगह की मति भिन्न हो जाती है , एक कुएं का पानी दूसरे कुएं के पानी से अलग होता है। एक सप्रदाय दूसरे सप्रदाय के बारे में अलग आकलन रखता है। ...( व्यवधान ) लोगों की जो वाणी है , बेटे की , बाप की , चाचा की , भतीजे की , दूसरे समाज की सबों की वाणी में फर्क होता है। मैंने इन लोगों से ज्यादा उम्मीद पाल ली थी। ये लोग इसी तरह की भाषा बोलते रहेंगे , इसलिए मुझे वेद - पुराण से सीख लेनी चाहिए। भ्रष्टाचार की बात अभी अनुराग सिंह ठाकुर जी कह रहे थे , एक कहावत है बुरा जो देखन मैं चला बुरा न मिलए कोई , जो दिन खोजा आपना मुझसे बुरा न कोई। आप करप्शन की बात कह रहे हैं , जिसके कारण पूरी की पूरी कांग्रेस खत्म हो गई और देश के लोगों ने माननीय प्रधानमंत्री जी के नेतृत्व में भारतीय जनता पार्टी को इतना बड़ा समर्थन दिया। इसी सदन में वर्ष 2009 में … * * का मामला मैंने उठाया था , इसी सदन में उठाया था , लेकिन कांग्रेस के किसी आदमी को साहस नहीं हुआ कि वह उसके ऊपर केस कर पाए।",234,hi
HON. DEPUTY SPEAKER,The name will not go on record.,7,en
श्री निशिकान्त दुबे,"इसी सदन में कांग्रेस के वित्त मंत्री जी ने कहा कि किसी भी मेंबर ऑफ पार्लियामेंट का ब्लैक मनी से कोई लेना देना नहीं है। क्या एचएसबीसी की जो लिस्ट छप रही है उसमें कांग्रेस के मेंबर ऑफ पार्लियामेंट का नाम नहीं है। यह बात मैंने सदन में उठाई थी। चूंकि वह अब संसद सदस्य नहीं हैं , इसलिए मैं उनका नाम नहीं लेना चाहता हूं , लेकिन किसी ने इसके ऊपर ध्यान नहीं दिया। आज देश कह रहा है कि एक एमपी दूसरे एमपी को बचाने का प्रयास कर रहा है। लोग इस सरकार को लाए और कांग्रेस पार्टी का इस देश में क्या हुआ , वह बताने की आवश्यकता नहीं है। आज के अखबार में , अभी जो पूरा जासूसी का मामला चल रहा है , यह प्रधानमंत्री जी के कमिटमेंट को दिखाता है। जिस दिन वह पहली बार प्रधानमंत्री बने थे और भारतीय जनता पार्टी के सांसदों को संबोधित किया था तो उन्होंने कहा था कि इस देश में 300-400 लोग हैं। जब आप मेंबर ऑफ पार्लियामेंट बन कर आते हैं तो वह आपको एयरपोर्ट से रिसिव कर लेता है , सुबह से चाय पिलाने से लेकर रात के सुलाने तक का काम करता है। इन लोगों को पकड़ने की आवश्यकता है , इन लोगों से दूर रहने की आवश्यकता है। यही कारण है कि आज इस तरह के जासूसी कांड में लोग पकड़े जा रहे हैं। प्रधानमंत्री जी के आदेश पर आईबी , सीबीआई , दिल्ली पुलिस एक्शन ले रही है। आपने क्या किया , माननीय वीरप्पा मोइली जी मंत्री रहे हैं। वर्ष 2013 का मेरे पास लेटर है , इसी तरह की एक घटना कॉरपोरेट अफेयर्स मिनिस्ट्री में भी हुई थी , रिबॉक कंपनी की पूरी फाइल गायब हो गई थी , उसमें जो एक्युजड था , उसको बिना एफआईआर के आपने फ्री कर दिया। यह पटियाला कोर्ट का आर्डर है , जिसे मैं आपके लिए लेकर आया हूं। राष्ट्रपति के अभिभाषण में भ्रष्टाचार हटाने की बात है तो आपको लगता है कि कुछ नहीं है। यदि कुछ नहीं है तो इसका फैसला जनता करेगी। दूसरा सवाल यह है कि अभी ब्लैकमनी पर बड़ी चर्चा हुई। अभी माननीय अनुराग सिंह ठाकुर ने कहा कि एसआईटी क्या कर रही है ? मानननीय प्रधान मंत्री जी जब जी -20 से लेकर अलग - अलग प्लेटफार्म पर जाते हैं तो क्या बात करते हैं ? लेकिन अलग - अलग चर्चा होती है कि ब्लैकमनी आयेगी या नहीं आयेगी ? उस दिन मेरे भाषण को भी तोड़ - मरोड़ कर पेश किया गया। मैंने कहा था कि आप जब कम्पनियों पर टैक्स लगाते हैं तो वह रेट्रोस्पेक्टिव टैक्स लगाते हैं , लेकिन जब आप दूसरी कंट्री के साथ समझौता करने जाते हैं तो प्रॉसपेक्टिव समझौता करते हैं। जब आप प्रॉसपेक्टिव समझौता करते हैं तो क्या स्विटजरलैंड जैसा देश आपके लिए वेट करेगा कि तीन साल बाद भारत सरकार आयेगी और उसे हम सारा नाम दे देंगे ? यदि आप गरीबी हटाने की बात करते हैं तो मैं आपको बैंक के नैशनलाइजेशन की बात बताना चाहता हूं। यदि आप अपने गिरेबां में झांकने का प्रयास करेंगे ...( व्यवधान ) जब बैंक नैशनलाइज्ड हो रहा था तो इंदिरा जी ने क्या कहा ? उनका यह स्टेटमैंट बहुत फेमस है , जो उन्होंने इसी पार्लियामैंट में बोला है। उसे मैं कोट कर रहा हूं। उस दिन मैं बोल रहा था तो सोनिया जी बड़ी नाराज हो रही थीं। उन्होंने कहा -- There has been serious imbalance in the development of banking facilities as between different regions in the country. There is urgent need to expand banking facilities in the States which are under-banked. Even in the developed States, banking facilities are confined to the urban areas, especially to the metropolitan areas, to the comparative neglect of semi-urban and rural areas. यह बड़ा इम्पोर्टैंट है और कल्याण बनर्जी साहब , आपके लिए बहुत इम्पोर्टैंट है। उन्होंने कहा -- The State-wise credit and deposit ratio has shown that it is very low in several States such as Assam, Bihar, Rajasthan, Odisha, Uttar Pradesh, Madhya Pradesh, Haryana, Punjab etc. उनका यह भाषण 29 जुलाई , 1969 का है। आज हम 46 साल बाद इसी सदन में यह बात कर रहे हैं। यहां ओडिशा के सांसद बैठे हुए हैं। मैं उनसे पूछना चाहता हूं कि वहां सीडी रेशियो क्या है ? मैं झारखंड और बिहार के बारे में जानता हूं कि सीडी रेडिशो आज भी उतना ही है। ...( व्यवधान ) कल्याण बनर्जी साहब , आप बताइये कि बंगाल में क्या है ? नार्थ ईस्ट के स्टेट में क्या है ? क्या कोई कांग्रेस से सवाल पूछ रहा है कि ब्लैकमनी के बारे में प्रधान मंत्री ने कहां कहा ? उन्होंने बाहर कहा। इस सदन में जो बात प्रधान मंत्री जी कहते हैं , उस बात की क्या कोई वैल्यू है ? इन 46 सालों में सीडी रेशियो वहीं का वहीं है और आप हमसे सवाल पूछ रहे हैं और कह रहे हैं कि आप जवाब दीजिए। ...( व्यवधान )",814,hi
श्री मल्लिकार्जुन खड़गे ( गुलबर्गा ),आप भाषण कीजिए। ...( व्यवधान ),6,hi
