Speaker,Speech,Words_in_Speech,Language
श्री मल्लिकार्जुन खड़गे,"हमारा कहना है कि 50 प्रतिशत कम हुआ , लेकिन देश में प्राइसेज 50 प्रतिशत कम नहीं हुए , एक्साइज और कस्टम्स डय़ूटी लगाकर वह पैसा सरकार ने लिया। आज इससे कम से कम 17000 करोड़ रुपये का फायदा सरकार को हुआ , लेकिन कस्टमर्स को उसका कोई फायदा नहीं हुआ , कन्ज्यूमर को उसका फायदा नहीं हुआ। इसीलिए आप यह जो बोल रहे हैं कि 17 प्रतिशत कम किया , वह इंटरनेशनल मार्केट की देन है। आप हमेशा कहते हैं कि मेरी किस्मत अच्छी है और अच्छी किस्मत वालों को चुनिए। आपने कहा था कि आपकी किस्मत अच्छी है , इसलिए इंटरनेशनल मार्केट में दाम घट गए हैं , इसलिए आपने 17 प्रतिशत कमी की , लेकिन आपको प्राइसेज 50 प्रतिशत कम करना चाहिए था। इस बात को आप मानिए। आपको यह बेनिफिट कन्ज्यूमर को देना चाहिए था , कन्ज्यूमर को कोई फायदा नहीं मिला। अब जीडीपी ग्रोथ की बात है , उसके बारे में आपने बहुत से आंकड़े दिए हैं , लेकिन आपकी 7.4 प्रतिशत की जीडीपी ग्रोथ है , उसका बेस क्या है ? किस बेसिस पर यह 7.4 प्रतिशत आया है ? 2004-05 के आधार पर ग्रोथ सिर्फ 0.4 प्रतिशत है। हमारे वर्ष 2004-05 का और आपके वर्ष 2011-12 के जो बेस पॉइंट हैं , आप उस देख लीजिए। वर्ष 2004-05 और वर्ष 2011-12 की कीमतें देख कर आप जीडीपी ग्रोथ की अनुमान लगा सकते हैं।... ( व्यवधान ) हमारे समय में वर्ष 2011-12 के अनुमान से चले तो ग्रोथ 6.9 है और उससे देखा जाए तो जो आप 7.9 ग्रोथ की बात कर रहे हैं , उसमें सिर्फ 0.5 परसेंट की ग्रोथ का अंतर है।... ( व्यवधान ) मैं यह पूछना चाहता हूं कि जीडीपी की ग्रोथ के साथ कितना रोजगार बढ़ा , कितना इनवेस्टमेंट आया और कितने लोगों को नौकरी मिली ? जब जीडीपी ग्रोथ होती है तो आप आंकड़ा देखिए कि कितने लोगों को नौकरी दी है ?...( व्यवधान ) आपने बताया कि कितनी नौकरियां बढ़ गई हैं , लेकिन यह नहीं बताया कि कितने लोगों को नौकरियां मिली हैं।... ( व्यवधान ) आपका रोजगार में कोई इजाफा नहीं हुआ , इनवेस्टमेंट में ज्यादा इजाफा नहीं हुआ। इसके बावजूद आपने 7.4 ग्रोथ रेट का आंकड़ा दिया है क्योंकि आप वर्ष 2011-12 से कम्पेयर कर रहे हैं। अगर उससे कम्पेयर करें तो 6.9 का प्रीवियस आंकड़ा है। आप लोगों को , देश को गुमराह मत कीजिए। आप लोगों को सच बताएं। आपको कोई रोकने वाला नहीं है। अगर सच्चाई की बात करेंगे तभी देश के लिए अच्छा होगा।... ( व्यवधान ) अंत में मैं कहना चाहता हूं कि आपने कहा था कि 33 प्रतिशत आरक्षण महिलाओं को दिया जाएगा लेकिन इस बार लगता है कि आप उसे भूल गए हैं या वह विषय छूट गया है या प्रिंट नहीं हुआ है , यह बात मुझे मालूम नहीं है। 33 प्रतिशत विमन रिजर्वेशन का क्या हुआ ? मैं आपको ये सारी चीजें इसलिए बता रहा हूं कि आपका कहना अलग है , लेकिन इम्प्लिमेंट करना या न करना अलग बात है। आज इम्प्लिमेंट करने में बहुत फर्क है। जैसे कथनी और करनी में फर्क कहते हैं , वैसे ही हो रहा है। मैं एक ही बात आपको बताऊंगा।... ( व्यवधान ) ‘ जख्म तीखे लगे , रूह चिल्ला पड़ी , दर्द उनको हुआ और घाव हमें लगा। दुनियाभर के इंसानों का यही कहना है , सबके हक में अमन और चैन से जिंदा रहना है। पास न आने दो नफरत के तुफानों को , प्यार की आज जरूरत है , सब इंसानों को। प्यार की मिट्टी से पैदा लयकार तो होगी , सदियों की सोई दुनिया बेदार तो होगी। ’ इसलिए आप नफरत पैदा करने की दुनिया मत बनाओ। अमन की दुनिया बनाओ , मोहब्बत की दुनिया बनाओ और आप अपने सभी लोगों को कहिए , आपके जितने भी चाहने वाले हैं , उन्हें कहिए कि ऐसा मत कीजिए। यह दुनिया के लिए अच्छा नहीं , देश के लिए भी अच्छा नहीं है और मेरे लिए भी अच्छा नहीं है। आपने मुझे बहुत वक्त दिया , इसीलिए आपका धन्यवाद। मैंने जो मुद्दे उठाए , उन्हें प्रधानमंत्री जी गंभीरता से लें क्योंकि पहली बार प्रधानमंत्री जी यहां कम से कम तीन घंटे से बैठे हैं। जब प्रधानमंत्री जी ने सुना है , तो स्वाभाविक है कि वे इसके ऊपर एक्ट करेंगे , ऐसा मैं सोचता हूं।",710,hi
HON. DEPUTY SPEAKER,"Kharge Ji, I want to make once again the point which I raised. The Parliament is supreme. We may make observations outside. We must not take advantage and debate those issues here. This is what I feel.",37,en
SHRI MALLIKARJUN KHARGE,"As the Prime Minister, if he speaks something outside, I have to speak on that thing. … (Interruptions)",18,en
HON. DEPUTY SPEAKER,"I am not talking about the Prime Minister. I am telling with regard to the President of America. With regard to the President of America, he made some reservations. This is what I feel. It is left to you. I feel personally that the name of the President of America must be removed. We can say as the President of America . … (Interruptions)",64,en
HON. DEPUTY SPEAKER,"You can say whatever you want to say. But I personally feel that his name should not be used. You have every right to speak. It is up to you. If you feel that the name of the President of America be recorded, then I have no objection. … (Interruptions)",50,en
HON. DEPUTY SPEAKER,"You are Opposition Leader. You have a right to speak. You have many points to speak. But taking the name of the person who is not in this House is not correct. I feel that this is not correct. Therefore, I feel that his name should be removed . … (Interruptions)",51,en
HON. DEPUTY SPEAKER,"If you feel that his name should be in the record, then I do not have any objection.",18,en
SHRI MALLIKARJUN KHARGE,"Sir, I correct it by referring to him as the President of America. … (Interruptions)",15,en
HON. DEPUTY SPEAKER,The name will be removed. But the term “ the President of America ” will be there.,17,en
SHRI MALLIKARJUN KHARGE,"I am thankful to you. Still I have got three points. If you allow me, I will speak.",18,en
HON. DEPUTY SPEAKER,You can speak whatever you want.,6,en
SHRI MALLIKARJUN KHARGE,"I have three or four points. Our Prime Minister has also heard. It is not my intention to hurt anybody. The country is supreme. That is why, I said that if U.S President reminds us our own constitution, it will not give a good message.",45,en
HON. DEPUTY SPEAKER,"That is what, I am telling.",6,en
SHRI MALLIKARJUN KHARGE,One should restrain from acting.,5,en
HON. DEPUTY SPEAKER,Whatever you are saying is correct.,6,en
SHRI MALLIKARJUN KHARGE,"So, with all these remarks, I am thankful to you. You have given sufficient time to me to express my views. I am thankful to you once again. TEXTS OF AMENDMENTS DR. P. VENUGOPAL (TIRUVALLUR): Thank you Sir for giving me an opportunity to speak on the Motion of Thanks on the President’s Address 2015. At the outset, I thank our guiding force and our able leaderPuratchi Thalaivi Ammafor enabling me to participate in this discussion. The House is now discussing the customary address by the President to both the Houses of Parliament spelling the policies of this Government. His Excellency, the President of India has underlined the point that our Parliament is thesanctum sanctorumof democracy. While saying that, he has also stated that this Government will endeavour to ensure smooth conduct of Parliament and enact progressive laws. Arriving at consensus can always enable smooth conduct of business. I would like to impress upon the Government that efforts to arrive at a common view must be given priority. For instance, the GST Bill which calls for a constitution amendment is before this House. That enactment will have far and wide consequences that may cut into the vitals of our spirit of cooperative federalism. Time and again, our leader Amma has been stressing on the need to arrive at a consensus. This is necessary to ensure the financial management of the State Governments. We need to arrive at a common view on Revenue Neutral Rates, compensation methodology and threshold. Fiscal autonomy of the States must be respected so that our federal structure is not affected. Hon. President in his Address has stated that petrol price has been decreased by more than Rs.17 a litre. We must have a reality check. This has happened just because the crude oil prices in the international market have fallen drastically. When a consumer in America can get about four litres of petrol, that is, a gallon at a cost of one dollar, that is, Rs.61, the cost of petrol is still costlier in our country. In the global economic scenario, we need to wake up to the reality. Oil import bill has come down and the Union Government has increased the excise duty while State Governments get reduced Sales Tax collection. Similarly, we must see that our Indian electronics import bill is also not left to the mercy of the tax regime. Inverted duty structure puts the domestic electronic hardware manufacture sector at a tremendous disadvantage. Ironically, the finished products can be imported duty free. When 65 per cent of the domestic demand for the electronic components is met by imports, we find duty levied on them is affecting our manufacturing sector. We are talking about ‘Make in India’ inviting the foreign companies with incentives. At the same time, we must help our domestic manufacturers to survive. Only then, there can be a level playing field. Increasing the share of manufacturing in the economy of Tamil Nadu was an important goal in the Vision 2023 Document of our revered leader. The aim of our Government of Tamil Nadu is to make our State, the most favoured manufacturing investment destination in India and one of the top three investment destinations in Asia. With a total outlay of Rs.1,83, 819 crore in both node infrastructure and trunk infrastructure, the Madurai-Thoothukudi Industrial Corridor Project Development Company is being established. When the Union Government spreads red carpet to foreign companies, they may also do well to take note of the proposed industrial ventures of our State. Hon. President said that the Government is fully committed to river linking with due consultations with the States’ concerned. The Union Government is still expected to spell out before the hon. Supreme Court its implementation plan of the inter-linking of rivers. It is also to be noted that the Union Government is yet to honour the directions of the Supreme Court based on the final order of the Cauvery Water Disputes Tribunal. Our national unity must not be threatened by Inter-State River Water Disputes and all of us must uphold the rule of law and respect the judicial verdicts. I would urge upon the Centre to impress upon all the stake-holders to realise this. When it comes to our External Affairs, our President stated that India’s destiny is linked with our neighbourhood. Instead of referring to issues like the resettlement and reconciliation in Sri Lanka or the unfriendly act of frequent attacks on Indian Tamil fishermen, our President talks about the deeper political, economic and security relations with Japan, USA and also China along with Russia. While talking about Look East Policy anchored in our relations with Southeast Asia, the President talks about extending it to Australia and the Pacific Islands. The mention of Sri Lanka and the vexed issue of not completing the rehabilitation programme have been avoided. This is necessary because India has funded heavily for the resettlement programme. Our Tamil Nadu under the dynamic leadership and guidance of our revolutionary leader has reversed the trend of child sex ratio through our bold initiatives like Cradle Baby Scheme and Girl Child Protection Scheme. This has made Tamil Nadu to be a leader in the welfare and protection of girl children and women. When there is a decline in the child sex ratio in the national scene, the Union Government seeks to focus on saving and educating the girl child. I urge upon the Union Government to declare Tamil Nadu as a model State for this path-breaking initiative. Since 2001, 5.26 lakh girl children have been covered under the Girl Child Protection Scheme with an outlay of Rs.865.39 crore. Tamil Nadu is now a pioneering State in promoting female education and increasing the age of girls at marriage. Hon. President referred to India as the fastest growing large economy in the world and we are moving towards GDP growth of 7.4 per cent. At this juncture, I want to suggest to this Government that they must not rely entirely on cooked up figures. I say this because recently many of the newspapers have rebuked this Government for the claim they made that we have achieved 6.9 per cent growth rate. In a vast country like ours with 125 crore mouths to be fed, our food security is entirely dependent on our farmers. Our beloved President statedAnnadata Sukhibhava,which means those who provide food must live long with adequate security and protection. He also states that it is one of our fundamental values. This has been reiterated long back by the Tamil Saint Poet Thiruvalluvar: Suzhanrum yerpinnathu ulagam athanaal Uzhandum uzhave thalai This reference has been made when the President wanted to say that his government attaches enormous importance to the well-being of farmers. I must point out here that Tamil Nadu Village Habitation Improvement (THAI) Scheme implemented from May 2011 with an allocation of Rs.2390 crore till date aims at improving the basic amenities in the rural areas benefiting farmers and agricultural workers. Union Government’s ambitious Digital India Programme to ensure service-oriented, transparent governance has been spelt out in this Address. I would like to state here that our State of Tamil Nadu has already taken a lead in this Information Technology initiative. Further, infrastructure development for this IT sector and other sectors is to be expanded. We are on the lookout for adequate funds. I urge upon the Centre to extend a special financial package to Tamil Nadu to translate into action the policies we evolve and spell out. With this I conclude. Thank you. PROF. SAUGATA ROY (DUM DUM): Hon. Deputy Speaker Sir, I rise to speak on behalf of All India Trinamool Congress on the Motion of Thanks and I stand here in support of my amendments. I shall not try to counter the arguments given by the ruling party Members Shri Anurag Singh Thakur and Shri Nishikant Dubey because they are ministerial hopefuls and they spoke with an eye to the next reshuffle. So their point should not be taken seriously. I think at this stage, this Article 87 according to which the President makes his special Address to Parliament should be facially thought of because actually the Article makes a person speak what he does not believe in, that is the President’s Speech. The President’s speech has quoted various persons and announced schemes in new names. They include quotes from Shyama Prasad Mukherjee and Deendayal Upadhyay. The President’s Speech does not have any quotation from Gandhiji, Jawaharlal Nehru, Rabindranath Tagore or Swami Vivekananda. These two persons were only leaders of the BJP; they were not national leaders. Why should they be quoted in the President’s Speech? Also, there is a new scheme announced in the name of Nanaji Deshmukh. He was not even a leader of BJP and a new scheme has been announced by the President in his name. I strongly object to that. The President’s Speech mentions some new steps. The Government has been busy in dismantling old structures and repackaging old schemes. They have dismantled the Planning Commission and jettisoned the planning process without any consensus and consultation with the States. But nobody till now knows what the NITI Aayog is supposed to do, how the Plan funds to the States will be distributed. They have discontinued the Jawaharlal Nehru National Urban Renewal Mission for the towns but the urban development mission has not yet been finalized. Nobody knows what the smart cities stand for. So the whole Government seems to be work in progress; nothing has been finalized. The Government has only repackaged the old schemes. The Accelerated Irrigation Benefit Programme has become the Pradhan Mantri Krishi Sinchai Yojana; the Nirmal Bharat Abhiyan has become the Swachch Bharat Mission; the Prime Minister’s financial inclusion programme which was in 12thPlan document has become Pradhan Mantri Jan Dhan Yojana; the Rajiv Gandhi Grameen Vidyutikaran Yojana has become the Deendayal Upadhyaya Gram Jyoti Yojana; the Ganga Action Plan has become Namami Gange. In this House, I had objected for all new schemes being named after Nehrus or Gandhis. I wanted a scheme in the name of Netaji. But the new Government does not think Netaji’s name should be there. They have new schemes only in the name of small leaders of their party. In the name of Pandit Deendayal Upadhyaya we have 3 schemes in his names- Deendayal Upadhyaya Gram Jyoti Yojana, Deendayal Upadhyaya Grameen Kaushalya Yojana and Deendayal Upadhyaya Antyodaya Yojana. So in the name of one leader of their party who is not even a national leader, they have named three schemes. This Government which the President called ‘my Government’ is a Government of packaging and photo opportunities. The Prime Minister dresses up in Rs 10 lakh suit and he is photographed wielding a broom and then he is followed by film actors. There are only photo opportunities, only advertisements but no content in this Government. What is happening down below is another story. The Prime Minister does not stop with photo opportunities. He also gives soundbytes, "" मन की बात "" यह तो पूरा फिल्म एक्टर जैसा हुआ , यह प्रधानमंत्री का काम नहीं होता है। I want to say that the Government came into power with a clear majority, raising high hopes among the people. The P.M. promised to bring back all the black money stashed abroad and put in Rs. 15 lakh in every householder’s account. In that hope, a large number of accounts were opened under the Pradhan Mantri Jan-Dhan Yojana but eight months later these hopes are belied. रुपया वापस लाए क्या ? Now, people have reacted. आपके नॉन फुलफिलमैंट ऑफ प्रॉमिसेज़ से लोगों ने आठ महीने में रियैक्ट किया। दिल्ली में सातों लोक सभा सीट आपको मिली थीं , लेकिन केवल तीन सीटें आपको इस बार विधान सभा में मिलीं। I have never heard that the number of MLAs of a party is less than the number of MPs in the city of Delhi, the national capital. This is your condition today… (Interruptions) In Bihar, they tried to prevent Shri Nitish Kumar from becoming Chief Minister but they could not. In West Bengal, the BJP was third in a Parliamentary bye-election proving that all their big talk and visit of the BJP President have not created any impact in our State. … (Interruptions) Please introspect, Mr. Anurag Thakur, why your popularity is coming down so badly. You have to introspect; not only must some leader from the Congress but you also introspect. … (Interruptions)",2075,hi
