Speaker,Speech,Words_in_Speech,Language
Preamble,Titel: Discussion on the Motion of Thanks on the President’s Address to both Houses of Parliament assembled together on 23.02.2015 moved by Shri Anurag Singh Thakur and seconded by Shri Nishikant Dubey (Discussion not concluded).,35,en
HON. SPEAKER,"Now, we will take up Item No. 10 – Shri Anurag Singh Thakur.",13,en
